{
    "recipe_id": "llm_inference_nvidia",
    "recipe_mode": "service",
    "deployment_name": "autoscale_vllm_example",
    "recipe_image_uri": "iad.ocir.io/iduyx1qnmway/corrino-devops-repository:vllmv0.6.5",
    "recipe_node_shape": "VM.GPU.A10.2",
    "recipe_replica_count": 1,
    "recipe_container_port": "8000",
    "recipe_nvidia_gpu_count": 1,
    "recipe_container_command_args": [
        "--model",
        "NousResearch/Meta-Llama-3.1-8B-Instruct",
        "--tensor-parallel-size",
        "1",
        "--gpu-memory-utilization",
        "0.99",
        "--max-model-len",
        "4096"
    ],
    "recipe_ephemeral_storage_size": 200,
    "recipe_node_boot_volume_size_in_gbs": 300,
    "recipe_node_pool_size": 1,
    "recipe_shared_memory_volume_size_limit_in_mb": 200,
    "recipe_startup_probe_params": {
      "failure_threshold": 30,
      "endpoint_path": "/health",
      "port": 8000,
      "scheme": "HTTP",
      "initial_delay_seconds": 60,
      "period_seconds": 2,
      "success_threshold": 1,
      "timeout_seconds": 1
    },
    "recipe_liveness_probe_params": {
      "failure_threshold": 1,
      "endpoint_path": "/health",
      "port": 8000,
      "scheme": "HTTP",
      "initial_delay_seconds": 65,
      "period_seconds": 600,
      "success_threshold": 1,
      "timeout_seconds": 1
    },
    "recipe_pod_autoscaling_params": {
      "min_replicas": 1,
      "max_replicas": 4,
      "scaling_threshold": 0.1
    },
    "recipe_node_autoscaling_params": {
      "min_nodes": 1,
      "max_nodes": 2
    }
}