{
    "recipe_id": "llm_inference_nvidia",
    "recipe_mode": "service",
    "deployment_name": "autoscale_mig",
    "recipe_image_uri": "iad.ocir.io/iduyx1qnmway/corrino-devops-repository:vllmv0.6.5",
    "recipe_node_shape": "BM.GPU.H100.8",
    "recipe_container_env": [
    {
        "key": "tensor_parallel_size",
        "value": "1"
    },
    {
      "key": "HF_TOKEN",
      "value": "<hf_token>"
    }
    ],
    "recipe_replica_count": 1,
    "recipe_container_port": "8000",
    "recipe_nvidia_gpu_count": 1,
    "recipe_use_shared_node_pool": true,
    "mig_resource_request": "1g.10gb",
    "recipe_container_command_args": [
        "--model",
        "meta-llama/Llama-3.2-3B-Instruct",
        "--dtype",
        "bfloat16",
        "--tensor-parallel-size",
        "$(tensor_parallel_size)",
        "--gpu-memory-utilization",
        "0.99",
        "--max-model-len",
        "16384"
    ],
    "recipe_ephemeral_storage_size": 30,
    "recipe_node_boot_volume_size_in_gbs": 300,
    "recipe_shared_memory_volume_size_limit_in_mb": 1000,
    "recipe_startup_probe_params": {
      "failure_threshold": 30,
      "endpoint_path": "/health",
      "port": 8000,
      "scheme": "HTTP",
      "initial_delay_seconds": 10,
      "period_seconds": 2,
      "success_threshold": 1,
      "timeout_seconds": 1
    },
    "recipe_liveness_probe_params": {
      "failure_threshold": 3,
      "endpoint_path": "/health",
      "port": 8000,
      "scheme": "HTTP",
      "initial_delay_seconds": 65,
      "period_seconds": 600,
      "success_threshold": 1,
      "timeout_seconds": 1
    },
    "recipe_pod_autoscaling_params": {
      "min_replicas": 1,
      "max_replicas": 50
    }
}
